19:08:24.923733 IP client-lan1.42677 > server-link1.www: Flags [S], seq 1392480968, win 5840, options [mss 1460,sackOK,TS val 720846 ecr 0,nop,wscale 6], length 0
19:08:24.924030 IP server-link1.www > client-lan1.42677: Flags [S.], seq 3949076735, ack 1392480969, win 5792, options [mss 1460,sackOK,TS val 720873 ecr 720846,nop,wscale 6], length 0
19:08:24.927326 IP client-lan1.42677 > server-link1.www: Flags [F.], seq 117, ack 1332, win 137, options [nop,nop,TS val 720847 ecr 720873], length 0
19:08:24.927524 IP server-link1.www > client-lan1.42677: Flags [F.], seq 1332, ack 118, win 91, options [nop,nop,TS val 720873 ecr 720847], length 0
19:08:25.198169 IP client-lan1.42678 > server-link1.www: Flags [S], seq 2802612216, win 5840, options [mss 1460,sackOK,TS val 720915 ecr 0,nop,wscale 6], length 0
19:08:25.198436 IP server-link1.www > client-lan1.42678: Flags [S.], seq 929903368, ack 2802612217, win 5792, options [mss 1460,sackOK,TS val 720941 ecr 720915,nop,wscale 6], length 0
19:08:25.201746 IP client-lan1.42678 > server-link1.www: Flags [F.], seq 117, ack 2125, win 182, options [nop,nop,TS val 720916 ecr 720942], length 0
19:08:25.201979 IP server-link1.www > client-lan1.42678: Flags [F.], seq 2125, ack 118, win 91, options [nop,nop,TS val 720942 ecr 720916], length 0
19:08:25.322757 IP client-lan1.42679 > server-link1.www: Flags [S], seq 3421408344, win 5840, options [mss 1460,sackOK,TS val 720946 ecr 0,nop,wscale 6], length 0
19:08:25.322934 IP server-link1.www > client-lan1.42679: Flags [S.], seq 3799001525, ack 3421408345, win 5792, options [mss 1460,sackOK,TS val 720972 ecr 720946,nop,wscale 6], length 0
19:08:25.326855 IP client-lan1.42679 > server-link1.www: Flags [F.], seq 117, ack 7212, win 318, options [nop,nop,TS val 720947 ecr 720973], length 0
19:08:25.327076 IP server-link1.www > client-lan1.42679: Flags [F.], seq 7212, ack 118, win 91, options [nop,nop,TS val 720973 ecr 720947], length 0
19:08:25.473845 IP client-lan1.42680 > server-link1.www: Flags [S], seq 223060039, win 5840, options [mss 1460,sackOK,TS val 720984 ecr 0,nop,wscale 6], length 0
19:08:25.474041 IP server-link1.www > client-lan1.42680: Flags [S.], seq 661859420, ack 223060040, win 5792, options [mss 1460,sackOK,TS val 721010 ecr 720984,nop,wscale 6], length 0
19:08:25.477410 IP client-lan1.42680 > server-link1.www: Flags [F.], seq 117, ack 2915, win 182, options [nop,nop,TS val 720985 ecr 721011], length 0
19:08:25.477633 IP server-link1.www > client-lan1.42680: Flags [F.], seq 2915, ack 118, win 91, options [nop,nop,TS val 721011 ecr 720985], length 0
19:08:25.567322 IP client-lan1.42681 > server-link1.www: Flags [S], seq 3495013698, win 5840, options [mss 1460,sackOK,TS val 721007 ecr 0,nop,wscale 6], length 0
19:08:25.567539 IP server-link1.www > client-lan1.42681: Flags [S.], seq 3848294534, ack 3495013699, win 5792, options [mss 1460,sackOK,TS val 721033 ecr 721007,nop,wscale 6], length 0
19:08:25.570842 IP client-lan1.42681 > server-link1.www: Flags [F.], seq 117, ack 2664, win 182, options [nop,nop,TS val 721008 ecr 721034], length 0
19:08:25.571082 IP server-link1.www > client-lan1.42681: Flags [F.], seq 2664, ack 118, win 91, options [nop,nop,TS val 721034 ecr 721008], length 0
19:08:25.697710 IP client-lan1.42682 > server-link1.www: Flags [S], seq 2495797678, win 5840, options [mss 1460,sackOK,TS val 721040 ecr 0,nop,wscale 6], length 0
19:08:25.697927 IP server-link1.www > client-lan1.42682: Flags [S.], seq 919012565, ack 2495797679, win 5792, options [mss 1460,sackOK,TS val 721066 ecr 721040,nop,wscale 6], length 0
19:08:25.701761 IP client-lan1.42682 > server-link1.www: Flags [F.], seq 117, ack 7898, win 363, options [nop,nop,TS val 721041 ecr 721067], length 0
19:08:25.702019 IP server-link1.www > client-lan1.42682: Flags [F.], seq 7898, ack 118, win 91, options [nop,nop,TS val 721067 ecr 721041], length 0
19:08:25.905651 IP client-lan1.42683 > server-link1.www: Flags [S], seq 2594227087, win 5840, options [mss 1460,sackOK,TS val 721092 ecr 0,nop,wscale 6], length 0
19:08:25.905841 IP server-link1.www > client-lan1.42683: Flags [S.], seq 220399418, ack 2594227088, win 5792, options [mss 1460,sackOK,TS val 721118 ecr 721092,nop,wscale 6], length 0
19:08:25.909388 IP client-lan1.42683 > server-link1.www: Flags [F.], seq 117, ack 4851, win 273, options [nop,nop,TS val 721093 ecr 721119], length 0
19:08:25.909683 IP server-link1.www > client-lan1.42683: Flags [F.], seq 4851, ack 118, win 91, options [nop,nop,TS val 721119 ecr 721093], length 0
19:08:25.969495 IP client-lan1.42684 > server-link1.www: Flags [S], seq 3929641769, win 5840, options [mss 1460,sackOK,TS val 721108 ecr 0,nop,wscale 6], length 0
19:08:25.969738 IP server-link1.www > client-lan1.42684: Flags [S.], seq 2853918886, ack 3929641770, win 5792, options [mss 1460,sackOK,TS val 721134 ecr 721108,nop,wscale 6], length 0
19:08:25.973455 IP client-lan1.42684 > server-link1.www: Flags [F.], seq 117, ack 5285, win 273, options [nop,nop,TS val 721109 ecr 721135], length 0
19:08:25.973729 IP server-link1.www > client-lan1.42684: Flags [F.], seq 5285, ack 118, win 91, options [nop,nop,TS val 721135 ecr 721109], length 0
19:08:26.088893 IP client-lan1.42685 > server-link1.www: Flags [S], seq 604309271, win 5840, options [mss 1460,sackOK,TS val 721138 ecr 0,nop,wscale 6], length 0
19:08:26.089192 IP server-link1.www > client-lan1.42685: Flags [S.], seq 2923905995, ack 604309272, win 5792, options [mss 1460,sackOK,TS val 721164 ecr 721138,nop,wscale 6], length 0
19:08:26.093138 IP client-lan1.42685 > server-link1.www: Flags [F.], seq 117, ack 9047, win 408, options [nop,nop,TS val 721139 ecr 721165], length 0
19:08:26.093435 IP server-link1.www > client-lan1.42685: Flags [F.], seq 9047, ack 118, win 91, options [nop,nop,TS val 721165 ecr 721139], length 0
19:08:26.103728 IP client-lan1.42686 > server-link1.www: Flags [S], seq 3770998788, win 5840, options [mss 1460,sackOK,TS val 721141 ecr 0,nop,wscale 6], length 0
19:08:26.104019 IP server-link1.www > client-lan1.42686: Flags [S.], seq 1955735108, ack 3770998789, win 5792, options [mss 1460,sackOK,TS val 721168 ecr 721141,nop,wscale 6], length 0
19:08:26.107908 IP client-lan1.42686 > server-link1.www: Flags [F.], seq 117, ack 6540, win 318, options [nop,nop,TS val 721142 ecr 721168], length 0
19:08:26.108212 IP server-link1.www > client-lan1.42686: Flags [F.], seq 6540, ack 118, win 91, options [nop,nop,TS val 721169 ecr 721142], length 0
19:08:26.613979 IP client-lan1.42687 > server-link1.www: Flags [S], seq 250385886, win 5840, options [mss 1460,sackOK,TS val 721269 ecr 0,nop,wscale 6], length 0
19:08:26.614243 IP server-link1.www > client-lan1.42687: Flags [S.], seq 1238699498, ack 250385887, win 5792, options [mss 1460,sackOK,TS val 721295 ecr 721269,nop,wscale 6], length 0
19:08:26.618126 IP client-lan1.42687 > server-link1.www: Flags [F.], seq 117, ack 8193, win 363, options [nop,nop,TS val 721270 ecr 721296], length 0
19:08:26.618385 IP server-link1.www > client-lan1.42687: Flags [F.], seq 8193, ack 118, win 91, options [nop,nop,TS val 721296 ecr 721270], length 0
19:08:27.036551 IP client-lan1.42688 > server-link1.www: Flags [S], seq 3058842624, win 5840, options [mss 1460,sackOK,TS val 721375 ecr 0,nop,wscale 6], length 0
19:08:27.036808 IP server-link1.www > client-lan1.42688: Flags [S.], seq 2331654170, ack 3058842625, win 5792, options [mss 1460,sackOK,TS val 721401 ecr 721375,nop,wscale 6], length 0
19:08:27.040770 IP client-lan1.42688 > server-link1.www: Flags [F.], seq 117, ack 10166, win 408, options [nop,nop,TS val 721376 ecr 721401], length 0
19:08:27.040950 IP server-link1.www > client-lan1.42688: Flags [F.], seq 10166, ack 118, win 91, options [nop,nop,TS val 721402 ecr 721376], length 0
19:08:27.433609 IP client-lan1.42689 > server-link1.www: Flags [S], seq 1291270185, win 5840, options [mss 1460,sackOK,TS val 721474 ecr 0,nop,wscale 6], length 0
19:08:27.433864 IP server-link1.www > client-lan1.42689: Flags [S.], seq 3794126983, ack 1291270186, win 5792, options [mss 1460,sackOK,TS val 721500 ecr 721474,nop,wscale 6], length 0
19:08:27.437276 IP client-lan1.42689 > server-link1.www: Flags [F.], seq 117, ack 2577, win 182, options [nop,nop,TS val 721475 ecr 721501], length 0
19:08:27.437457 IP server-link1.www > client-lan1.42689: Flags [F.], seq 2577, ack 118, win 91, options [nop,nop,TS val 721501 ecr 721475], length 0
19:08:27.590331 IP client-lan1.42690 > server-link1.www: Flags [S], seq 1705638830, win 5840, options [mss 1460,sackOK,TS val 721513 ecr 0,nop,wscale 6], length 0
19:08:27.590510 IP server-link1.www > client-lan1.42690: Flags [S.], seq 3673693594, ack 1705638831, win 5792, options [mss 1460,sackOK,TS val 721539 ecr 721513,nop,wscale 6], length 0
19:08:27.594226 IP client-lan1.42690 > server-link1.www: Flags [F.], seq 117, ack 5990, win 318, options [nop,nop,TS val 721514 ecr 721540], length 0
19:08:27.594403 IP server-link1.www > client-lan1.42690: Flags [F.], seq 5990, ack 118, win 91, options [nop,nop,TS val 721540 ecr 721514], length 0
19:08:27.643425 IP client-lan1.42691 > server-link1.www: Flags [S], seq 1486947573, win 5840, options [mss 1460,sackOK,TS val 721526 ecr 0,nop,wscale 6], length 0
19:08:27.643675 IP server-link1.www > client-lan1.42691: Flags [S.], seq 423516515, ack 1486947574, win 5792, options [mss 1460,sackOK,TS val 721552 ecr 721526,nop,wscale 6], length 0
19:08:27.647079 IP client-lan1.42691 > server-link1.www: Flags [F.], seq 117, ack 2864, win 182, options [nop,nop,TS val 721527 ecr 721553], length 0
19:08:27.647269 IP server-link1.www > client-lan1.42691: Flags [F.], seq 2864, ack 118, win 91, options [nop,nop,TS val 721553 ecr 721527], length 0
19:08:27.843381 IP client-lan1.42692 > server-link1.www: Flags [S], seq 2398966016, win 5840, options [mss 1460,sackOK,TS val 721576 ecr 0,nop,wscale 6], length 0
19:08:27.843601 IP server-link1.www > client-lan1.42692: Flags [S.], seq 3197425392, ack 2398966017, win 5792, options [mss 1460,sackOK,TS val 721602 ecr 721576,nop,wscale 6], length 0
19:08:27.847541 IP client-lan1.42692 > server-link1.www: Flags [F.], seq 117, ack 9832, win 408, options [nop,nop,TS val 721577 ecr 721603], length 0
19:08:27.847743 IP server-link1.www > client-lan1.42692: Flags [F.], seq 9832, ack 118, win 91, options [nop,nop,TS val 721603 ecr 721577], length 0
19:08:27.924165 IP client-lan1.42693 > server-link1.www: Flags [S], seq 2428121808, win 5840, options [mss 1460,sackOK,TS val 721597 ecr 0,nop,wscale 6], length 0
19:08:27.924371 IP server-link1.www > client-lan1.42693: Flags [S.], seq 3620704130, ack 2428121809, win 5792, options [mss 1460,sackOK,TS val 721623 ecr 721597,nop,wscale 6], length 0
19:08:27.928349 IP client-lan1.42693 > server-link1.www: Flags [F.], seq 117, ack 8141, win 363, options [nop,nop,TS val 721598 ecr 721623], length 0
19:08:27.928562 IP server-link1.www > client-lan1.42693: Flags [F.], seq 8141, ack 118, win 91, options [nop,nop,TS val 721623 ecr 721598], length 0
19:08:28.018523 IP client-lan1.42694 > server-link1.www: Flags [S], seq 1498799987, win 5840, options [mss 1460,sackOK,TS val 721620 ecr 0,nop,wscale 6], length 0
19:08:28.018868 IP server-link1.www > client-lan1.42694: Flags [S.], seq 67989474, ack 1498799988, win 5792, options [mss 1460,sackOK,TS val 721646 ecr 721620,nop,wscale 6], length 0
19:08:28.022949 IP client-lan1.42694 > server-link1.www: Flags [F.], seq 117, ack 8279, win 363, options [nop,nop,TS val 721621 ecr 721647], length 0
19:08:28.023161 IP server-link1.www > client-lan1.42694: Flags [F.], seq 8279, ack 118, win 91, options [nop,nop,TS val 721647 ecr 721621], length 0
19:08:28.099730 IP client-lan1.42695 > server-link1.www: Flags [S], seq 4012454204, win 5840, options [mss 1460,sackOK,TS val 721640 ecr 0,nop,wscale 6], length 0
19:08:28.100035 IP server-link1.www > client-lan1.42695: Flags [S.], seq 1883316264, ack 4012454205, win 5792, options [mss 1460,sackOK,TS val 721667 ecr 721640,nop,wscale 6], length 0
19:08:28.104011 IP client-lan1.42695 > server-link1.www: Flags [F.], seq 117, ack 1972, win 182, options [nop,nop,TS val 721641 ecr 721667], length 0
19:08:28.104227 IP server-link1.www > client-lan1.42695: Flags [F.], seq 1972, ack 118, win 91, options [nop,nop,TS val 721667 ecr 721641], length 0
19:08:28.615865 IP client-lan1.42696 > server-link1.www: Flags [S], seq 3375255942, win 5840, options [mss 1460,sackOK,TS val 721769 ecr 0,nop,wscale 6], length 0
19:08:28.616099 IP server-link1.www > client-lan1.42696: Flags [S.], seq 2946422164, ack 3375255943, win 5792, options [mss 1460,sackOK,TS val 721796 ecr 721769,nop,wscale 6], length 0
19:08:28.648904 IP client-lan1.42696 > server-link1.www: Flags [F.], seq 117, ack 10090, win 408, options [nop,nop,TS val 721778 ecr 721796], length 0
19:08:28.649097 IP server-link1.www > client-lan1.42696: Flags [F.], seq 10090, ack 118, win 91, options [nop,nop,TS val 721803 ecr 721778], length 0
19:08:28.675050 IP client-lan1.42697 > server-link1.www: Flags [S], seq 1124853424, win 5840, options [mss 1460,sackOK,TS val 721784 ecr 0,nop,wscale 6], length 0
19:08:28.675253 IP server-link1.www > client-lan1.42697: Flags [S.], seq 794719081, ack 1124853425, win 5792, options [mss 1460,sackOK,TS val 721810 ecr 721784,nop,wscale 6], length 0
19:08:28.679081 IP client-lan1.42697 > server-link1.www: Flags [F.], seq 117, ack 7645, win 363, options [nop,nop,TS val 721785 ecr 721811], length 0
19:08:28.679245 IP server-link1.www > client-lan1.42697: Flags [F.], seq 7645, ack 118, win 91, options [nop,nop,TS val 721811 ecr 721785], length 0
19:08:28.703437 IP client-lan1.42698 > server-link1.www: Flags [S], seq 18352145, win 5840, options [mss 1460,sackOK,TS val 721791 ecr 0,nop,wscale 6], length 0
19:08:28.703607 IP server-link1.www > client-lan1.42698: Flags [S.], seq 2595267535, ack 18352146, win 5792, options [mss 1460,sackOK,TS val 721817 ecr 721791,nop,wscale 6], length 0
19:08:28.706806 IP client-lan1.42698 > server-link1.www: Flags [F.], seq 117, ack 1932, win 182, options [nop,nop,TS val 721792 ecr 721818], length 0
19:08:28.706951 IP server-link1.www > client-lan1.42698: Flags [F.], seq 1932, ack 118, win 91, options [nop,nop,TS val 721818 ecr 721792], length 0
19:08:28.966348 IP client-lan1.42699 > server-link1.www: Flags [S], seq 93492161, win 5840, options [mss 1460,sackOK,TS val 721857 ecr 0,nop,wscale 6], length 0
19:08:28.966581 IP server-link1.www > client-lan1.42699: Flags [S.], seq 2589560526, ack 93492162, win 5792, options [mss 1460,sackOK,TS val 721883 ecr 721857,nop,wscale 6], length 0
19:08:28.970277 IP client-lan1.42699 > server-link1.www: Flags [F.], seq 117, ack 5096, win 273, options [nop,nop,TS val 721858 ecr 721884], length 0
19:08:28.970474 IP server-link1.www > client-lan1.42699: Flags [F.], seq 5096, ack 118, win 91, options [nop,nop,TS val 721884 ecr 721858], length 0
19:08:29.249211 IP client-lan1.42700 > server-link1.www: Flags [S], seq 1869251864, win 5840, options [mss 1460,sackOK,TS val 721928 ecr 0,nop,wscale 6], length 0
19:08:29.249473 IP server-link1.www > client-lan1.42700: Flags [S.], seq 2555979794, ack 1869251865, win 5792, options [mss 1460,sackOK,TS val 721954 ecr 721928,nop,wscale 6], length 0
19:08:29.254034 IP client-lan1.42700 > server-link1.www: Flags [F.], seq 117, ack 9667, win 408, options [nop,nop,TS val 721929 ecr 721955], length 0
19:08:29.254314 IP server-link1.www > client-lan1.42700: Flags [F.], seq 9667, ack 118, win 91, options [nop,nop,TS val 721955 ecr 721929], length 0
19:08:29.683719 IP client-lan1.42701 > server-link1.www: Flags [S], seq 41313091, win 5840, options [mss 1460,sackOK,TS val 722036 ecr 0,nop,wscale 6], length 0
19:08:29.683919 IP server-link1.www > client-lan1.42701: Flags [S.], seq 395559813, ack 41313092, win 5792, options [mss 1460,sackOK,TS val 722063 ecr 722036,nop,wscale 6], length 0
19:08:29.687891 IP client-lan1.42701 > server-link1.www: Flags [F.], seq 117, ack 2252, win 182, options [nop,nop,TS val 722037 ecr 722063], length 0
19:08:29.688111 IP server-link1.www > client-lan1.42701: Flags [F.], seq 2252, ack 118, win 91, options [nop,nop,TS val 722063 ecr 722037], length 0
19:08:29.756240 IP client-lan1.42702 > server-link1.www: Flags [S], seq 206238103, win 5840, options [mss 1460,sackOK,TS val 722054 ecr 0,nop,wscale 6], length 0
19:08:29.756451 IP server-link1.www > client-lan1.42702: Flags [S.], seq 1031156528, ack 206238104, win 5792, options [mss 1460,sackOK,TS val 722081 ecr 722054,nop,wscale 6], length 0
19:08:29.759969 IP client-lan1.42702 > server-link1.www: Flags [F.], seq 117, ack 4446, win 227, options [nop,nop,TS val 722055 ecr 722081], length 0
19:08:29.760194 IP server-link1.www > client-lan1.42702: Flags [F.], seq 4446, ack 118, win 91, options [nop,nop,TS val 722081 ecr 722055], length 0
19:08:29.770968 IP client-lan1.42703 > server-link1.www: Flags [S], seq 3668263628, win 5840, options [mss 1460,sackOK,TS val 722058 ecr 0,nop,wscale 6], length 0
19:08:29.771178 IP server-link1.www > client-lan1.42703: Flags [S.], seq 4066115942, ack 3668263629, win 5792, options [mss 1460,sackOK,TS val 722084 ecr 722058,nop,wscale 6], length 0
19:08:29.774333 IP client-lan1.42703 > server-link1.www: Flags [F.], seq 117, ack 1654, win 182, options [nop,nop,TS val 722059 ecr 722085], length 0
19:08:29.774571 IP server-link1.www > client-lan1.42703: Flags [F.], seq 1654, ack 118, win 91, options [nop,nop,TS val 722085 ecr 722059], length 0
19:08:29.866971 IP client-lan1.42704 > server-link1.www: Flags [S], seq 2202318531, win 5840, options [mss 1460,sackOK,TS val 722082 ecr 0,nop,wscale 6], length 0
19:08:29.867222 IP server-link1.www > client-lan1.42704: Flags [S.], seq 1868605023, ack 2202318532, win 5792, options [mss 1460,sackOK,TS val 722108 ecr 722082,nop,wscale 6], length 0
19:08:29.871443 IP client-lan1.42704 > server-link1.www: Flags [F.], seq 117, ack 8319, win 363, options [nop,nop,TS val 722083 ecr 722109], length 0
19:08:29.871665 IP server-link1.www > client-lan1.42704: Flags [F.], seq 8319, ack 118, win 91, options [nop,nop,TS val 722109 ecr 722083], length 0
19:08:29.878093 IP client-lan1.42705 > server-link1.www: Flags [S], seq 3359529391, win 5840, options [mss 1460,sackOK,TS val 722085 ecr 0,nop,wscale 6], length 0
19:08:29.878304 IP server-link1.www > client-lan1.42705: Flags [S.], seq 3271782654, ack 3359529392, win 5792, options [mss 1460,sackOK,TS val 722111 ecr 722085,nop,wscale 6], length 0
19:08:29.882163 IP client-lan1.42705 > server-link1.www: Flags [F.], seq 117, ack 10092, win 454, options [nop,nop,TS val 722086 ecr 722112], length 0
19:08:29.882397 IP server-link1.www > client-lan1.42705: Flags [F.], seq 10092, ack 118, win 91, options [nop,nop,TS val 722112 ecr 722086], length 0
19:08:30.375417 IP client-lan1.42706 > server-link1.www: Flags [S], seq 456249922, win 5840, options [mss 1460,sackOK,TS val 722209 ecr 0,nop,wscale 6], length 0
19:08:30.375698 IP server-link1.www > client-lan1.42706: Flags [S.], seq 4018843237, ack 456249923, win 5792, options [mss 1460,sackOK,TS val 722235 ecr 722209,nop,wscale 6], length 0
19:08:30.379102 IP client-lan1.42706 > server-link1.www: Flags [F.], seq 117, ack 2276, win 182, options [nop,nop,TS val 722210 ecr 722236], length 0
19:08:30.379342 IP server-link1.www > client-lan1.42706: Flags [F.], seq 2276, ack 118, win 91, options [nop,nop,TS val 722236 ecr 722210], length 0
19:08:30.464310 IP client-lan1.42707 > server-link1.www: Flags [S], seq 3238838228, win 5840, options [mss 1460,sackOK,TS val 722231 ecr 0,nop,wscale 6], length 0
19:08:30.464504 IP server-link1.www > client-lan1.42707: Flags [S.], seq 2196500311, ack 3238838229, win 5792, options [mss 1460,sackOK,TS val 722258 ecr 722231,nop,wscale 6], length 0
19:08:30.469106 IP client-lan1.42707 > server-link1.www: Flags [F.], seq 117, ack 8878, win 408, options [nop,nop,TS val 722233 ecr 722259], length 0
19:08:30.469346 IP server-link1.www > client-lan1.42707: Flags [F.], seq 8878, ack 118, win 91, options [nop,nop,TS val 722259 ecr 722233], length 0
19:08:30.753351 IP client-lan1.42708 > server-link1.www: Flags [S], seq 3871001821, win 5840, options [mss 1460,sackOK,TS val 722304 ecr 0,nop,wscale 6], length 0
19:08:30.753587 IP server-link1.www > client-lan1.42708: Flags [S.], seq 3662586772, ack 3871001822, win 5792, options [mss 1460,sackOK,TS val 722330 ecr 722304,nop,wscale 6], length 0
19:08:30.757822 IP client-lan1.42708 > server-link1.www: Flags [F.], seq 117, ack 1407, win 137, options [nop,nop,TS val 722305 ecr 722331], length 0
19:08:30.758082 IP server-link1.www > client-lan1.42708: Flags [F.], seq 1407, ack 118, win 91, options [nop,nop,TS val 722331 ecr 722305], length 0
19:08:30.760983 IP client-lan1.42709 > server-link1.www: Flags [S], seq 3744416953, win 5840, options [mss 1460,sackOK,TS val 722306 ecr 0,nop,wscale 6], length 0
19:08:30.761173 IP server-link1.www > client-lan1.42709: Flags [S.], seq 1338721714, ack 3744416954, win 5792, options [mss 1460,sackOK,TS val 722332 ecr 722306,nop,wscale 6], length 0
19:08:30.765152 IP client-lan1.42709 > server-link1.www: Flags [F.], seq 117, ack 2989, win 182, options [nop,nop,TS val 722307 ecr 722333], length 0
19:08:30.765416 IP server-link1.www > client-lan1.42709: Flags [F.], seq 2989, ack 118, win 91, options [nop,nop,TS val 722333 ecr 722307], length 0
19:08:30.848226 IP client-lan1.42710 > server-link1.www: Flags [S], seq 2506011100, win 5840, options [mss 1460,sackOK,TS val 722327 ecr 0,nop,wscale 6], length 0
19:08:30.848432 IP server-link1.www > client-lan1.42710: Flags [S.], seq 2831436951, ack 2506011101, win 5792, options [mss 1460,sackOK,TS val 722354 ecr 722327,nop,wscale 6], length 0
19:08:30.852940 IP client-lan1.42710 > server-link1.www: Flags [F.], seq 117, ack 8722, win 363, options [nop,nop,TS val 722329 ecr 722355], length 0
19:08:30.853173 IP server-link1.www > client-lan1.42710: Flags [F.], seq 8722, ack 118, win 91, options [nop,nop,TS val 722355 ecr 722329], length 0
19:08:30.977189 IP client-lan1.42711 > server-link1.www: Flags [S], seq 305209116, win 5840, options [mss 1460,sackOK,TS val 722360 ecr 0,nop,wscale 6], length 0
19:08:30.977373 IP server-link1.www > client-lan1.42711: Flags [S.], seq 4126951235, ack 305209117, win 5792, options [mss 1460,sackOK,TS val 722386 ecr 722360,nop,wscale 6], length 0
19:08:30.981212 IP client-lan1.42711 > server-link1.www: Flags [F.], seq 117, ack 9389, win 408, options [nop,nop,TS val 722361 ecr 722387], length 0
19:08:30.981465 IP server-link1.www > client-lan1.42711: Flags [F.], seq 9389, ack 118, win 91, options [nop,nop,TS val 722387 ecr 722361], length 0
19:08:31.400575 IP client-lan1.42712 > server-link1.www: Flags [S], seq 2718806230, win 5840, options [mss 1460,sackOK,TS val 722466 ecr 0,nop,wscale 6], length 0
19:08:31.400837 IP server-link1.www > client-lan1.42712: Flags [S.], seq 2744891075, ack 2718806231, win 5792, options [mss 1460,sackOK,TS val 722492 ecr 722466,nop,wscale 6], length 0
19:08:31.404871 IP client-lan1.42712 > server-link1.www: Flags [F.], seq 117, ack 8173, win 363, options [nop,nop,TS val 722467 ecr 722493], length 0
19:08:31.405079 IP server-link1.www > client-lan1.42712: Flags [F.], seq 8173, ack 118, win 91, options [nop,nop,TS val 722493 ecr 722467], length 0
19:08:31.558990 IP client-lan1.42713 > server-link1.www: Flags [S], seq 3633602204, win 5840, options [mss 1460,sackOK,TS val 722505 ecr 0,nop,wscale 6], length 0
19:08:31.559232 IP server-link1.www > client-lan1.42713: Flags [S.], seq 935669266, ack 3633602205, win 5792, options [mss 1460,sackOK,TS val 722531 ecr 722505,nop,wscale 6], length 0
19:08:31.563302 IP client-lan1.42713 > server-link1.www: Flags [F.], seq 117, ack 5727, win 273, options [nop,nop,TS val 722506 ecr 722532], length 0
19:08:31.563529 IP server-link1.www > client-lan1.42713: Flags [F.], seq 5727, ack 118, win 91, options [nop,nop,TS val 722532 ecr 722506], length 0
19:08:31.564454 IP client-lan1.42714 > server-link1.www: Flags [S], seq 3232859124, win 5840, options [mss 1460,sackOK,TS val 722507 ecr 0,nop,wscale 6], length 0
19:08:31.564671 IP server-link1.www > client-lan1.42714: Flags [S.], seq 1343439496, ack 3232859125, win 5792, options [mss 1460,sackOK,TS val 722533 ecr 722507,nop,wscale 6], length 0
19:08:31.568571 IP client-lan1.42714 > server-link1.www: Flags [F.], seq 117, ack 9148, win 408, options [nop,nop,TS val 722508 ecr 722533], length 0
19:08:31.568766 IP server-link1.www > client-lan1.42714: Flags [F.], seq 9148, ack 118, win 91, options [nop,nop,TS val 722534 ecr 722508], length 0
19:08:31.633640 IP client-lan1.42715 > server-link1.www: Flags [S], seq 413687475, win 5840, options [mss 1460,sackOK,TS val 722524 ecr 0,nop,wscale 6], length 0
19:08:31.633860 IP server-link1.www > client-lan1.42715: Flags [S.], seq 492217387, ack 413687476, win 5792, options [mss 1460,sackOK,TS val 722550 ecr 722524,nop,wscale 6], length 0
19:08:31.637520 IP client-lan1.42715 > server-link1.www: Flags [F.], seq 117, ack 5402, win 273, options [nop,nop,TS val 722525 ecr 722551], length 0
19:08:31.637702 IP server-link1.www > client-lan1.42715: Flags [F.], seq 5402, ack 118, win 91, options [nop,nop,TS val 722551 ecr 722525], length 0
19:08:31.765976 IP client-lan1.42716 > server-link1.www: Flags [S], seq 1180499021, win 5840, options [mss 1460,sackOK,TS val 722557 ecr 0,nop,wscale 6], length 0
19:08:31.766195 IP server-link1.www > client-lan1.42716: Flags [S.], seq 650936032, ack 1180499022, win 5792, options [mss 1460,sackOK,TS val 722583 ecr 722557,nop,wscale 6], length 0
19:08:31.769897 IP client-lan1.42716 > server-link1.www: Flags [F.], seq 117, ack 4870, win 273, options [nop,nop,TS val 722558 ecr 722584], length 0
19:08:31.770088 IP server-link1.www > client-lan1.42716: Flags [F.], seq 4870, ack 118, win 91, options [nop,nop,TS val 722584 ecr 722558], length 0
19:08:32.293585 IP client-lan1.42717 > server-link1.www: Flags [S], seq 1126801026, win 5840, options [mss 1460,sackOK,TS val 722689 ecr 0,nop,wscale 6], length 0
19:08:32.293840 IP server-link1.www > client-lan1.42717: Flags [S.], seq 4209106878, ack 1126801027, win 5792, options [mss 1460,sackOK,TS val 722715 ecr 722689,nop,wscale 6], length 0
19:08:32.297155 IP client-lan1.42717 > server-link1.www: Flags [F.], seq 117, ack 1692, win 182, options [nop,nop,TS val 722690 ecr 722716], length 0
19:08:32.297433 IP server-link1.www > client-lan1.42717: Flags [F.], seq 1692, ack 118, win 91, options [nop,nop,TS val 722716 ecr 722690], length 0
19:08:32.420408 IP client-lan1.42718 > server-link1.www: Flags [S], seq 299038808, win 5840, options [mss 1460,sackOK,TS val 722721 ecr 0,nop,wscale 6], length 0
19:08:32.420634 IP server-link1.www > client-lan1.42718: Flags [S.], seq 1423557167, ack 299038809, win 5792, options [mss 1460,sackOK,TS val 722747 ecr 722721,nop,wscale 6], length 0
19:08:32.424463 IP client-lan1.42718 > server-link1.www: Flags [F.], seq 117, ack 8535, win 363, options [nop,nop,TS val 722722 ecr 722747], length 0
19:08:32.424727 IP server-link1.www > client-lan1.42718: Flags [F.], seq 8535, ack 118, win 91, options [nop,nop,TS val 722748 ecr 722722], length 0
19:08:32.507063 IP client-lan1.42719 > server-link1.www: Flags [S], seq 1812806903, win 5840, options [mss 1460,sackOK,TS val 722742 ecr 0,nop,wscale 6], length 0
19:08:32.507294 IP server-link1.www > client-lan1.42719: Flags [S.], seq 3137216775, ack 1812806904, win 5792, options [mss 1460,sackOK,TS val 722768 ecr 722742,nop,wscale 6], length 0
19:08:32.511113 IP client-lan1.42719 > server-link1.www: Flags [F.], seq 117, ack 6707, win 318, options [nop,nop,TS val 722743 ecr 722769], length 0
19:08:32.511387 IP server-link1.www > client-lan1.42719: Flags [F.], seq 6707, ack 118, win 91, options [nop,nop,TS val 722769 ecr 722743], length 0
19:08:32.547378 IP client-lan1.42720 > server-link1.www: Flags [S], seq 2615018962, win 5840, options [mss 1460,sackOK,TS val 722752 ecr 0,nop,wscale 6], length 0
19:08:32.547578 IP server-link1.www > client-lan1.42720: Flags [S.], seq 1528345005, ack 2615018963, win 5792, options [mss 1460,sackOK,TS val 722778 ecr 722752,nop,wscale 6], length 0
19:08:32.550961 IP client-lan1.42720 > server-link1.www: Flags [F.], seq 117, ack 3467, win 227, options [nop,nop,TS val 722753 ecr 722779], length 0
19:08:32.551223 IP server-link1.www > client-lan1.42720: Flags [F.], seq 3467, ack 118, win 91, options [nop,nop,TS val 722779 ecr 722753], length 0
19:08:32.680609 IP client-lan1.42721 > server-link1.www: Flags [S], seq 457807775, win 5840, options [mss 1460,sackOK,TS val 722786 ecr 0,nop,wscale 6], length 0
19:08:32.680814 IP server-link1.www > client-lan1.42721: Flags [S.], seq 1109729212, ack 457807776, win 5792, options [mss 1460,sackOK,TS val 722812 ecr 722786,nop,wscale 6], length 0
19:08:32.684671 IP client-lan1.42721 > server-link1.www: Flags [F.], seq 117, ack 7104, win 318, options [nop,nop,TS val 722787 ecr 722812], length 0
19:08:32.684906 IP server-link1.www > client-lan1.42721: Flags [F.], seq 7104, ack 118, win 91, options [nop,nop,TS val 722813 ecr 722787], length 0
19:08:32.906115 IP client-lan1.42722 > server-link1.www: Flags [S], seq 898775587, win 5840, options [mss 1460,sackOK,TS val 722842 ecr 0,nop,wscale 6], length 0
19:08:32.906348 IP server-link1.www > client-lan1.42722: Flags [S.], seq 520615241, ack 898775588, win 5792, options [mss 1460,sackOK,TS val 722868 ecr 722842,nop,wscale 6], length 0
19:08:32.910270 IP client-lan1.42722 > server-link1.www: Flags [F.], seq 117, ack 7908, win 363, options [nop,nop,TS val 722843 ecr 722869], length 0
19:08:32.910539 IP server-link1.www > client-lan1.42722: Flags [F.], seq 7908, ack 118, win 91, options [nop,nop,TS val 722869 ecr 722843], length 0
19:08:32.969313 IP client-lan1.42723 > server-link1.www: Flags [S], seq 4142149000, win 5840, options [mss 1460,sackOK,TS val 722858 ecr 0,nop,wscale 6], length 0
19:08:32.969545 IP server-link1.www > client-lan1.42723: Flags [S.], seq 3258272921, ack 4142149001, win 5792, options [mss 1460,sackOK,TS val 722884 ecr 722858,nop,wscale 6], length 0
19:08:32.973329 IP client-lan1.42723 > server-link1.www: Flags [F.], seq 117, ack 6264, win 318, options [nop,nop,TS val 722859 ecr 722885], length 0
19:08:32.973588 IP server-link1.www > client-lan1.42723: Flags [F.], seq 6264, ack 118, win 91, options [nop,nop,TS val 722885 ecr 722859], length 0
19:08:33.239009 IP client-lan1.42724 > server-link1.www: Flags [S], seq 3419513320, win 5840, options [mss 1460,sackOK,TS val 722925 ecr 0,nop,wscale 6], length 0
19:08:33.239309 IP server-link1.www > client-lan1.42724: Flags [S.], seq 515023407, ack 3419513321, win 5792, options [mss 1460,sackOK,TS val 722951 ecr 722925,nop,wscale 6], length 0
19:08:33.243324 IP client-lan1.42724 > server-link1.www: Flags [F.], seq 117, ack 6583, win 318, options [nop,nop,TS val 722926 ecr 722952], length 0
19:08:33.243551 IP server-link1.www > client-lan1.42724: Flags [F.], seq 6583, ack 118, win 91, options [nop,nop,TS val 722952 ecr 722926], length 0
19:08:33.692860 IP client-lan1.42725 > server-link1.www: Flags [S], seq 284048516, win 5840, options [mss 1460,sackOK,TS val 723039 ecr 0,nop,wscale 6], length 0
19:08:33.693072 IP server-link1.www > client-lan1.42725: Flags [S.], seq 66433890, ack 284048517, win 5792, options [mss 1460,sackOK,TS val 723065 ecr 723039,nop,wscale 6], length 0
19:08:33.702385 IP client-lan1.42725 > server-link1.www: Flags [F.], seq 117, ack 6973, win 318, options [nop,nop,TS val 723041 ecr 723066], length 0
19:08:33.702607 IP server-link1.www > client-lan1.42725: Flags [F.], seq 6973, ack 118, win 91, options [nop,nop,TS val 723067 ecr 723041], length 0
19:08:33.820402 IP client-lan1.42726 > server-link1.www: Flags [S], seq 4027700756, win 5840, options [mss 1460,sackOK,TS val 723071 ecr 0,nop,wscale 6], length 0
19:08:33.820617 IP server-link1.www > client-lan1.42726: Flags [S.], seq 1715892142, ack 4027700757, win 5792, options [mss 1460,sackOK,TS val 723097 ecr 723071,nop,wscale 6], length 0
19:08:33.824442 IP client-lan1.42726 > server-link1.www: Flags [F.], seq 117, ack 6599, win 318, options [nop,nop,TS val 723072 ecr 723097], length 0
19:08:33.824660 IP server-link1.www > client-lan1.42726: Flags [F.], seq 6599, ack 118, win 91, options [nop,nop,TS val 723098 ecr 723072], length 0
19:08:34.329038 IP client-lan1.42727 > server-link1.www: Flags [S], seq 1160507339, win 5840, options [mss 1460,sackOK,TS val 723198 ecr 0,nop,wscale 6], length 0
19:08:34.329344 IP server-link1.www > client-lan1.42727: Flags [S.], seq 1610884864, ack 1160507340, win 5792, options [mss 1460,sackOK,TS val 723224 ecr 723198,nop,wscale 6], length 0
19:08:34.332684 IP client-lan1.42727 > server-link1.www: Flags [F.], seq 117, ack 2558, win 182, options [nop,nop,TS val 723199 ecr 723224], length 0
19:08:34.332936 IP server-link1.www > client-lan1.42727: Flags [F.], seq 2558, ack 118, win 91, options [nop,nop,TS val 723225 ecr 723199], length 0
19:08:34.398178 IP client-lan1.42728 > server-link1.www: Flags [S], seq 2703284767, win 5840, options [mss 1460,sackOK,TS val 723215 ecr 0,nop,wscale 6], length 0
19:08:34.398381 IP server-link1.www > client-lan1.42728: Flags [S.], seq 4116391009, ack 2703284768, win 5792, options [mss 1460,sackOK,TS val 723241 ecr 723215,nop,wscale 6], length 0
19:08:34.402223 IP client-lan1.42728 > server-link1.www: Flags [F.], seq 117, ack 9059, win 408, options [nop,nop,TS val 723216 ecr 723242], length 0
19:08:34.402473 IP server-link1.www > client-lan1.42728: Flags [F.], seq 9059, ack 118, win 91, options [nop,nop,TS val 723242 ecr 723216], length 0
19:08:34.689419 IP client-lan1.42729 > server-link1.www: Flags [S], seq 387032031, win 5840, options [mss 1460,sackOK,TS val 723288 ecr 0,nop,wscale 6], length 0
19:08:34.689608 IP server-link1.www > client-lan1.42729: Flags [S.], seq 475007480, ack 387032032, win 5792, options [mss 1460,sackOK,TS val 723314 ecr 723288,nop,wscale 6], length 0
19:08:34.693285 IP client-lan1.42729 > server-link1.www: Flags [F.], seq 117, ack 6012, win 318, options [nop,nop,TS val 723289 ecr 723315], length 0
19:08:34.693501 IP server-link1.www > client-lan1.42729: Flags [F.], seq 6012, ack 118, win 91, options [nop,nop,TS val 723315 ecr 723289], length 0
19:08:34.745968 IP client-lan1.42730 > server-link1.www: Flags [S], seq 3460818464, win 5840, options [mss 1460,sackOK,TS val 723302 ecr 0,nop,wscale 6], length 0
19:08:34.746167 IP server-link1.www > client-lan1.42730: Flags [S.], seq 1485032260, ack 3460818465, win 5792, options [mss 1460,sackOK,TS val 723328 ecr 723302,nop,wscale 6], length 0
19:08:34.749722 IP client-lan1.42730 > server-link1.www: Flags [F.], seq 117, ack 4548, win 273, options [nop,nop,TS val 723303 ecr 723329], length 0
19:08:34.749960 IP server-link1.www > client-lan1.42730: Flags [F.], seq 4548, ack 118, win 91, options [nop,nop,TS val 723329 ecr 723303], length 0
19:08:34.800355 IP client-lan1.42731 > server-link1.www: Flags [S], seq 395660660, win 5840, options [mss 1460,sackOK,TS val 723316 ecr 0,nop,wscale 6], length 0
19:08:34.800529 IP server-link1.www > client-lan1.42731: Flags [S.], seq 2319988964, ack 395660661, win 5792, options [mss 1460,sackOK,TS val 723342 ecr 723316,nop,wscale 6], length 0
19:08:34.804292 IP client-lan1.42731 > server-link1.www: Flags [F.], seq 117, ack 6461, win 318, options [nop,nop,TS val 723317 ecr 723342], length 0
19:08:34.804521 IP server-link1.www > client-lan1.42731: Flags [F.], seq 6461, ack 118, win 91, options [nop,nop,TS val 723342 ecr 723317], length 0
19:08:35.776565 IP client-lan1.42732 > server-link1.www: Flags [S], seq 2510706947, win 5840, options [mss 1460,sackOK,TS val 723560 ecr 0,nop,wscale 6], length 0
19:08:35.776797 IP server-link1.www > client-lan1.42732: Flags [S.], seq 3266864795, ack 2510706948, win 5792, options [mss 1460,sackOK,TS val 723586 ecr 723560,nop,wscale 6], length 0
19:08:35.780271 IP client-lan1.42732 > server-link1.www: Flags [F.], seq 117, ack 3241, win 227, options [nop,nop,TS val 723561 ecr 723586], length 0
19:08:35.780490 IP server-link1.www > client-lan1.42732: Flags [F.], seq 3241, ack 118, win 91, options [nop,nop,TS val 723587 ecr 723561], length 0
19:08:35.956821 IP client-lan1.42733 > server-link1.www: Flags [S], seq 3313379603, win 5840, options [mss 1460,sackOK,TS val 723605 ecr 0,nop,wscale 6], length 0
19:08:35.957005 IP server-link1.www > client-lan1.42733: Flags [S.], seq 1647096271, ack 3313379604, win 5792, options [mss 1460,sackOK,TS val 723631 ecr 723605,nop,wscale 6], length 0
19:08:35.960869 IP client-lan1.42733 > server-link1.www: Flags [F.], seq 117, ack 9392, win 408, options [nop,nop,TS val 723606 ecr 723632], length 0
19:08:35.961097 IP server-link1.www > client-lan1.42733: Flags [F.], seq 9392, ack 118, win 91, options [nop,nop,TS val 723632 ecr 723606], length 0
19:08:36.121791 IP client-lan1.42734 > server-link1.www: Flags [S], seq 3435549223, win 5840, options [mss 1460,sackOK,TS val 723646 ecr 0,nop,wscale 6], length 0
19:08:36.122037 IP server-link1.www > client-lan1.42734: Flags [S.], seq 1971142948, ack 3435549224, win 5792, options [mss 1460,sackOK,TS val 723672 ecr 723646,nop,wscale 6], length 0
19:08:36.125903 IP client-lan1.42734 > server-link1.www: Flags [F.], seq 117, ack 6504, win 318, options [nop,nop,TS val 723647 ecr 723673], length 0
19:08:36.126080 IP server-link1.www > client-lan1.42734: Flags [F.], seq 6504, ack 118, win 91, options [nop,nop,TS val 723673 ecr 723647], length 0
19:08:36.147494 IP client-lan1.42735 > server-link1.www: Flags [S], seq 2939464625, win 5840, options [mss 1460,sackOK,TS val 723652 ecr 0,nop,wscale 6], length 0
19:08:36.147745 IP server-link1.www > client-lan1.42735: Flags [S.], seq 1939790931, ack 2939464626, win 5792, options [mss 1460,sackOK,TS val 723678 ecr 723652,nop,wscale 6], length 0
19:08:36.151174 IP client-lan1.42735 > server-link1.www: Flags [F.], seq 117, ack 4096, win 227, options [nop,nop,TS val 723653 ecr 723679], length 0
19:08:36.151389 IP server-link1.www > client-lan1.42735: Flags [F.], seq 4096, ack 118, win 91, options [nop,nop,TS val 723679 ecr 723653], length 0
19:08:36.176363 IP client-lan1.42736 > server-link1.www: Flags [S], seq 1073049627, win 5840, options [mss 1460,sackOK,TS val 723660 ecr 0,nop,wscale 6], length 0
19:08:36.176599 IP server-link1.www > client-lan1.42736: Flags [S.], seq 3666037490, ack 1073049628, win 5792, options [mss 1460,sackOK,TS val 723686 ecr 723660,nop,wscale 6], length 0
19:08:36.180486 IP client-lan1.42736 > server-link1.www: Flags [F.], seq 117, ack 9372, win 408, options [nop,nop,TS val 723661 ecr 723686], length 0
19:08:36.180692 IP server-link1.www > client-lan1.42736: Flags [F.], seq 9372, ack 118, win 91, options [nop,nop,TS val 723686 ecr 723661], length 0
19:08:36.261560 IP client-lan1.42737 > server-link1.www: Flags [S], seq 1964704795, win 5840, options [mss 1460,sackOK,TS val 723681 ecr 0,nop,wscale 6], length 0
19:08:36.261811 IP server-link1.www > client-lan1.42737: Flags [S.], seq 3486946028, ack 1964704796, win 5792, options [mss 1460,sackOK,TS val 723707 ecr 723681,nop,wscale 6], length 0
19:08:36.265366 IP client-lan1.42737 > server-link1.www: Flags [F.], seq 117, ack 5355, win 273, options [nop,nop,TS val 723682 ecr 723708], length 0
19:08:36.265555 IP server-link1.www > client-lan1.42737: Flags [F.], seq 5355, ack 118, win 91, options [nop,nop,TS val 723708 ecr 723682], length 0
19:08:36.451749 IP client-lan1.42738 > server-link1.www: Flags [S], seq 3608955626, win 5840, options [mss 1460,sackOK,TS val 723728 ecr 0,nop,wscale 6], length 0
19:08:36.451903 IP server-link1.www > client-lan1.42738: Flags [S.], seq 2898149901, ack 3608955627, win 5792, options [mss 1460,sackOK,TS val 723755 ecr 723728,nop,wscale 6], length 0
19:08:36.455278 IP client-lan1.42738 > server-link1.www: Flags [F.], seq 117, ack 3687, win 227, options [nop,nop,TS val 723729 ecr 723755], length 0
