19:27:47.520074 IP client-lan1.46446 > server-link1.www: Flags [S], seq 3743032281, win 5840, options [mss 1460,sackOK,TS val 1011495 ecr 0,nop,wscale 6], length 0
19:27:47.520356 IP server-link1.www > client-lan1.46446: Flags [R.], seq 0, ack 3743032282, win 0, length 0
19:27:47.639142 IP client-lan1.46447 > server-link1.www: Flags [S], seq 4065749074, win 5840, options [mss 1460,sackOK,TS val 1011525 ecr 0,nop,wscale 6], length 0
19:27:47.639363 IP server-link1.www > client-lan1.46447: Flags [S.], seq 1681834721, ack 4065749075, win 5792, options [mss 1460,sackOK,TS val 1011551 ecr 1011525,nop,wscale 6], length 0
19:27:48.057985 IP client-lan1.46448 > server-link1.www: Flags [S], seq 2285260905, win 5840, options [mss 1460,sackOK,TS val 1011630 ecr 0,nop,wscale 6], length 0
19:27:48.058285 IP server-link1.www > client-lan1.46448: Flags [S.], seq 2131825024, ack 2285260906, win 5792, options [mss 1460,sackOK,TS val 1011656 ecr 1011630,nop,wscale 6], length 0
19:27:48.120812 IP client-lan1.46449 > server-link1.www: Flags [S], seq 1072483599, win 5840, options [mss 1460,sackOK,TS val 1011646 ecr 0,nop,wscale 6], length 0
19:27:48.121083 IP server-link1.www > client-lan1.46449: Flags [S.], seq 2497160449, ack 1072483600, win 5792, options [mss 1460,sackOK,TS val 1011671 ecr 1011646,nop,wscale 6], length 0
19:27:48.171160 IP client-lan1.46450 > server-link1.www: Flags [S], seq 600735125, win 5840, options [mss 1460,sackOK,TS val 1011658 ecr 0,nop,wscale 6], length 0
19:27:48.171402 IP server-link1.www > client-lan1.46450: Flags [S.], seq 2728008943, ack 600735126, win 5792, options [mss 1460,sackOK,TS val 1011684 ecr 1011658,nop,wscale 6], length 0
19:27:48.289658 IP client-lan1.46451 > server-link1.www: Flags [S], seq 3730804684, win 5840, options [mss 1460,sackOK,TS val 1011688 ecr 0,nop,wscale 6], length 0
19:27:48.289808 IP server-link1.www > client-lan1.46451: Flags [S.], seq 1833646422, ack 3730804685, win 5792, options [mss 1460,sackOK,TS val 1011713 ecr 1011688,nop,wscale 6], length 0
19:27:48.960481 IP client-lan1.46452 > server-link1.www: Flags [S], seq 2398545121, win 5840, options [mss 1460,sackOK,TS val 1011856 ecr 0,nop,wscale 6], length 0
19:27:48.960672 IP server-link1.www > client-lan1.46452: Flags [S.], seq 886784073, ack 2398545122, win 5792, options [mss 1460,sackOK,TS val 1011881 ecr 1011856,nop,wscale 6], length 0
19:27:48.977152 IP client-lan1.46453 > server-link1.www: Flags [S], seq 996015035, win 5840, options [mss 1460,sackOK,TS val 1011860 ecr 0,nop,wscale 6], length 0
19:27:48.977345 IP server-link1.www > client-lan1.46453: Flags [S.], seq 4041338875, ack 996015036, win 5792, options [mss 1460,sackOK,TS val 1011885 ecr 1011860,nop,wscale 6], length 0
19:27:49.483711 IP client-lan1.46454 > server-link1.www: Flags [S], seq 465781853, win 5840, options [mss 1460,sackOK,TS val 1011986 ecr 0,nop,wscale 6], length 0
19:27:49.483974 IP server-link1.www > client-lan1.46454: Flags [S.], seq 220478351, ack 465781854, win 5792, options [mss 1460,sackOK,TS val 1012012 ecr 1011986,nop,wscale 6], length 0
19:27:49.565142 IP client-lan1.46455 > server-link1.www: Flags [S], seq 2722954567, win 5840, options [mss 1460,sackOK,TS val 1012007 ecr 0,nop,wscale 6], length 0
19:27:49.565343 IP server-link1.www > client-lan1.46455: Flags [S.], seq 1384967079, ack 2722954568, win 5792, options [mss 1460,sackOK,TS val 1012032 ecr 1012007,nop,wscale 6], length 0
19:27:49.924456 IP client-lan1.46456 > server-link1.www: Flags [S], seq 3741140227, win 5840, options [mss 1460,sackOK,TS val 1012097 ecr 0,nop,wscale 6], length 0
19:27:49.924711 IP server-link1.www > client-lan1.46456: Flags [S.], seq 1140644057, ack 3741140228, win 5792, options [mss 1460,sackOK,TS val 1012122 ecr 1012097,nop,wscale 6], length 0
19:27:49.941139 IP client-lan1.46457 > server-link1.www: Flags [S], seq 3182534148, win 5840, options [mss 1460,sackOK,TS val 1012101 ecr 0,nop,wscale 6], length 0
19:27:49.941384 IP server-link1.www > client-lan1.46457: Flags [S.], seq 3109182364, ack 3182534149, win 5792, options [mss 1460,sackOK,TS val 1012126 ecr 1012101,nop,wscale 6], length 0
19:27:50.566077 IP client-lan1.46458 > server-link1.www: Flags [S], seq 2884739607, win 5840, options [mss 1460,sackOK,TS val 1012257 ecr 0,nop,wscale 6], length 0
19:27:50.566321 IP server-link1.www > client-lan1.46458: Flags [S.], seq 555135387, ack 2884739608, win 5792, options [mss 1460,sackOK,TS val 1012283 ecr 1012257,nop,wscale 6], length 0
19:27:50.723213 IP client-lan1.46459 > server-link1.www: Flags [S], seq 1377112848, win 5840, options [mss 1460,sackOK,TS val 1012296 ecr 0,nop,wscale 6], length 0
19:27:50.723417 IP server-link1.www > client-lan1.46459: Flags [S.], seq 3781437293, ack 1377112849, win 5792, options [mss 1460,sackOK,TS val 1012322 ecr 1012296,nop,wscale 6], length 0
19:27:50.767317 IP client-lan1.46460 > server-link1.www: Flags [S], seq 2153208500, win 5840, options [mss 1460,sackOK,TS val 1012307 ecr 0,nop,wscale 6], length 0
19:27:50.767545 IP server-link1.www > client-lan1.46460: Flags [S.], seq 3562273879, ack 2153208501, win 5792, options [mss 1460,sackOK,TS val 1012333 ecr 1012307,nop,wscale 6], length 0
19:27:50.897627 IP client-lan1.46461 > server-link1.www: Flags [S], seq 3789642462, win 5840, options [mss 1460,sackOK,TS val 1012340 ecr 0,nop,wscale 6], length 0
19:27:50.897834 IP server-link1.www > client-lan1.46461: Flags [S.], seq 2902494467, ack 3789642463, win 5792, options [mss 1460,sackOK,TS val 1012366 ecr 1012340,nop,wscale 6], length 0
19:27:51.310185 IP client-lan1.46462 > server-link1.www: Flags [S], seq 2427556966, win 5840, options [mss 1460,sackOK,TS val 1012443 ecr 0,nop,wscale 6], length 0
19:27:51.310465 IP server-link1.www > client-lan1.46462: Flags [S.], seq 561487124, ack 2427556967, win 5792, options [mss 1460,sackOK,TS val 1012469 ecr 1012443,nop,wscale 6], length 0
19:27:51.509659 IP client-lan1.46463 > server-link1.www: Flags [S], seq 368316438, win 5840, options [mss 1460,sackOK,TS val 1012493 ecr 0,nop,wscale 6], length 0
19:27:51.509892 IP server-link1.www > client-lan1.46463: Flags [S.], seq 2180596061, ack 368316439, win 5792, options [mss 1460,sackOK,TS val 1012519 ecr 1012493,nop,wscale 6], length 0
19:27:51.693651 IP client-lan1.46464 > server-link1.www: Flags [S], seq 3798150462, win 5840, options [mss 1460,sackOK,TS val 1012539 ecr 0,nop,wscale 6], length 0
19:27:51.693894 IP server-link1.www > client-lan1.46464: Flags [S.], seq 54925644, ack 3798150463, win 5792, options [mss 1460,sackOK,TS val 1012565 ecr 1012539,nop,wscale 6], length 0
19:27:52.090954 IP client-lan1.46465 > server-link1.www: Flags [S], seq 675689602, win 5840, options [mss 1460,sackOK,TS val 1012638 ecr 0,nop,wscale 6], length 0
19:27:52.091251 IP server-link1.www > client-lan1.46465: Flags [S.], seq 43284401, ack 675689603, win 5792, options [mss 1460,sackOK,TS val 1012664 ecr 1012638,nop,wscale 6], length 0
19:27:52.258497 IP client-lan1.46466 > server-link1.www: Flags [S], seq 3817115339, win 5840, options [mss 1460,sackOK,TS val 1012680 ecr 0,nop,wscale 6], length 0
19:27:52.258729 IP server-link1.www > client-lan1.46466: Flags [S.], seq 3878845057, ack 3817115340, win 5792, options [mss 1460,sackOK,TS val 1012706 ecr 1012680,nop,wscale 6], length 0
19:27:52.284801 IP client-lan1.46467 > server-link1.www: Flags [S], seq 2906853152, win 5840, options [mss 1460,sackOK,TS val 1012687 ecr 0,nop,wscale 6], length 0
19:27:52.285036 IP server-link1.www > client-lan1.46467: Flags [S.], seq 1578428014, ack 2906853153, win 5792, options [mss 1460,sackOK,TS val 1012712 ecr 1012687,nop,wscale 6], length 0
19:27:52.531576 IP client-lan1.46468 > server-link1.www: Flags [S], seq 3990642501, win 5840, options [mss 1460,sackOK,TS val 1012748 ecr 0,nop,wscale 6], length 0
19:27:52.531787 IP server-link1.www > client-lan1.46468: Flags [S.], seq 616978325, ack 3990642502, win 5792, options [mss 1460,sackOK,TS val 1012774 ecr 1012748,nop,wscale 6], length 0
19:27:52.582149 IP client-lan1.46469 > server-link1.www: Flags [S], seq 3672126808, win 5840, options [mss 1460,sackOK,TS val 1012761 ecr 0,nop,wscale 6], length 0
19:27:52.582354 IP server-link1.www > client-lan1.46469: Flags [S.], seq 2437184446, ack 3672126809, win 5792, options [mss 1460,sackOK,TS val 1012787 ecr 1012761,nop,wscale 6], length 0
19:27:52.950426 IP client-lan1.46470 > server-link1.www: Flags [S], seq 105188878, win 5840, options [mss 1460,sackOK,TS val 1012853 ecr 0,nop,wscale 6], length 0
19:27:52.950707 IP server-link1.www > client-lan1.46470: Flags [S.], seq 3767610255, ack 105188879, win 5792, options [mss 1460,sackOK,TS val 1012879 ecr 1012853,nop,wscale 6], length 0
19:27:52.965698 IP client-lan1.46471 > server-link1.www: Flags [S], seq 1252264630, win 5840, options [mss 1460,sackOK,TS val 1012857 ecr 0,nop,wscale 6], length 0
19:27:52.965933 IP server-link1.www > client-lan1.46471: Flags [S.], seq 48005936, ack 1252264631, win 5792, options [mss 1460,sackOK,TS val 1012882 ecr 1012857,nop,wscale 6], length 0
19:27:53.194415 IP client-lan1.46472 > server-link1.www: Flags [S], seq 3048883077, win 5840, options [mss 1460,sackOK,TS val 1012914 ecr 0,nop,wscale 6], length 0
19:27:53.194712 IP server-link1.www > client-lan1.46472: Flags [S.], seq 679786823, ack 3048883078, win 5792, options [mss 1460,sackOK,TS val 1012940 ecr 1012914,nop,wscale 6], length 0
19:27:53.585821 IP client-lan1.46473 > server-link1.www: Flags [S], seq 1830008267, win 5840, options [mss 1460,sackOK,TS val 1013012 ecr 0,nop,wscale 6], length 0
19:27:53.586078 IP server-link1.www > client-lan1.46473: Flags [S.], seq 3588683450, ack 1830008268, win 5792, options [mss 1460,sackOK,TS val 1013038 ecr 1013012,nop,wscale 6], length 0
19:27:53.663803 IP client-lan1.46474 > server-link1.www: Flags [S], seq 3739057528, win 5840, options [mss 1460,sackOK,TS val 1013031 ecr 0,nop,wscale 6], length 0
19:27:53.664052 IP server-link1.www > client-lan1.46474: Flags [S.], seq 1092939, ack 3739057529, win 5792, options [mss 1460,sackOK,TS val 1013057 ecr 1013031,nop,wscale 6], length 0
19:27:53.794517 IP client-lan1.46475 > server-link1.www: Flags [S], seq 2727248949, win 5840, options [mss 1460,sackOK,TS val 1013064 ecr 0,nop,wscale 6], length 0
19:27:53.794740 IP server-link1.www > client-lan1.46475: Flags [S.], seq 1576968056, ack 2727248950, win 5792, options [mss 1460,sackOK,TS val 1013090 ecr 1013064,nop,wscale 6], length 0
19:27:53.807635 IP client-lan1.46476 > server-link1.www: Flags [S], seq 1908438474, win 5840, options [mss 1460,sackOK,TS val 1013067 ecr 0,nop,wscale 6], length 0
19:27:53.807818 IP server-link1.www > client-lan1.46476: Flags [S.], seq 1721278473, ack 1908438475, win 5792, options [mss 1460,sackOK,TS val 1013093 ecr 1013067,nop,wscale 6], length 0
19:27:54.267916 IP client-lan1.46477 > server-link1.www: Flags [S], seq 1521488095, win 5840, options [mss 1460,sackOK,TS val 1013182 ecr 0,nop,wscale 6], length 0
19:27:54.268173 IP server-link1.www > client-lan1.46477: Flags [S.], seq 419575446, ack 1521488096, win 5792, options [mss 1460,sackOK,TS val 1013208 ecr 1013182,nop,wscale 6], length 0
19:27:54.333923 IP client-lan1.46478 > server-link1.www: Flags [S], seq 41477217, win 5840, options [mss 1460,sackOK,TS val 1013199 ecr 0,nop,wscale 6], length 0
19:27:54.334116 IP server-link1.www > client-lan1.46478: Flags [S.], seq 792046443, ack 41477218, win 5792, options [mss 1460,sackOK,TS val 1013225 ecr 1013199,nop,wscale 6], length 0
19:27:54.400262 IP client-lan1.46479 > server-link1.www: Flags [S], seq 1249928424, win 5840, options [mss 1460,sackOK,TS val 1013215 ecr 0,nop,wscale 6], length 0
19:27:54.400459 IP server-link1.www > client-lan1.46479: Flags [S.], seq 2815769745, ack 1249928425, win 5792, options [mss 1460,sackOK,TS val 1013241 ecr 1013215,nop,wscale 6], length 0
19:27:55.262721 IP client-lan1.46480 > server-link1.www: Flags [S], seq 4700539, win 5840, options [mss 1460,sackOK,TS val 1013431 ecr 0,nop,wscale 6], length 0
19:27:55.263010 IP server-link1.www > client-lan1.46480: Flags [S.], seq 1282839635, ack 4700540, win 5792, options [mss 1460,sackOK,TS val 1013457 ecr 1013431,nop,wscale 6], length 0
19:27:55.312370 IP client-lan1.46481 > server-link1.www: Flags [S], seq 431942224, win 5840, options [mss 1460,sackOK,TS val 1013444 ecr 0,nop,wscale 6], length 0
19:27:55.312531 IP server-link1.www > client-lan1.46481: Flags [S.], seq 1968886520, ack 431942225, win 5792, options [mss 1460,sackOK,TS val 1013469 ecr 1013444,nop,wscale 6], length 0
19:27:55.365126 IP client-lan1.46482 > server-link1.www: Flags [S], seq 3573693390, win 5840, options [mss 1460,sackOK,TS val 1013457 ecr 0,nop,wscale 6], length 0
19:27:55.365295 IP server-link1.www > client-lan1.46482: Flags [S.], seq 4248860036, ack 3573693391, win 5792, options [mss 1460,sackOK,TS val 1013482 ecr 1013457,nop,wscale 6], length 0
19:27:55.549700 IP client-lan1.46483 > server-link1.www: Flags [S], seq 3802253449, win 5840, options [mss 1460,sackOK,TS val 1013503 ecr 0,nop,wscale 6], length 0
19:27:55.549846 IP server-link1.www > client-lan1.46483: Flags [S.], seq 1728862531, ack 3802253450, win 5792, options [mss 1460,sackOK,TS val 1013529 ecr 1013503,nop,wscale 6], length 0
19:27:55.887645 IP client-lan1.46484 > server-link1.www: Flags [S], seq 3066236735, win 5840, options [mss 1460,sackOK,TS val 1013587 ecr 0,nop,wscale 6], length 0
19:27:55.887849 IP server-link1.www > client-lan1.46484: Flags [S.], seq 1953344618, ack 3066236736, win 5792, options [mss 1460,sackOK,TS val 1013613 ecr 1013587,nop,wscale 6], length 0
19:27:55.902261 IP client-lan1.46485 > server-link1.www: Flags [S], seq 2078902602, win 5840, options [mss 1460,sackOK,TS val 1013591 ecr 0,nop,wscale 6], length 0
19:27:55.902476 IP server-link1.www > client-lan1.46485: Flags [S.], seq 161419897, ack 2078902603, win 5792, options [mss 1460,sackOK,TS val 1013617 ecr 1013591,nop,wscale 6], length 0
19:27:56.021674 IP client-lan1.46486 > server-link1.www: Flags [S], seq 152894023, win 5840, options [mss 1460,sackOK,TS val 1013621 ecr 0,nop,wscale 6], length 0
19:27:56.021982 IP server-link1.www > client-lan1.46486: Flags [S.], seq 1748022867, ack 152894024, win 5792, options [mss 1460,sackOK,TS val 1013647 ecr 1013621,nop,wscale 6], length 0
19:27:56.092391 IP client-lan1.46487 > server-link1.www: Flags [S], seq 1829837664, win 5840, options [mss 1460,sackOK,TS val 1013639 ecr 0,nop,wscale 6], length 0
19:27:56.092618 IP server-link1.www > client-lan1.46487: Flags [S.], seq 25145500, ack 1829837665, win 5792, options [mss 1460,sackOK,TS val 1013664 ecr 1013639,nop,wscale 6], length 0
19:27:56.386493 IP client-lan1.46488 > server-link1.www: Flags [S], seq 1053511732, win 5840, options [mss 1460,sackOK,TS val 1013712 ecr 0,nop,wscale 6], length 0
19:27:56.386790 IP server-link1.www > client-lan1.46488: Flags [S.], seq 354735032, ack 1053511733, win 5792, options [mss 1460,sackOK,TS val 1013738 ecr 1013712,nop,wscale 6], length 0
19:27:56.427620 IP client-lan1.46489 > server-link1.www: Flags [S], seq 1678854002, win 5840, options [mss 1460,sackOK,TS val 1013722 ecr 0,nop,wscale 6], length 0
19:27:56.427823 IP server-link1.www > client-lan1.46489: Flags [S.], seq 2143988400, ack 1678854003, win 5792, options [mss 1460,sackOK,TS val 1013748 ecr 1013722,nop,wscale 6], length 0
19:27:56.646601 IP client-lan1.46490 > server-link1.www: Flags [S], seq 1620265150, win 5840, options [mss 1460,sackOK,TS val 1013777 ecr 0,nop,wscale 6], length 0
19:27:56.646820 IP server-link1.www > client-lan1.46490: Flags [S.], seq 3543565176, ack 1620265151, win 5792, options [mss 1460,sackOK,TS val 1013803 ecr 1013777,nop,wscale 6], length 0
19:27:56.930566 IP client-lan1.46491 > server-link1.www: Flags [S], seq 1958529579, win 5840, options [mss 1460,sackOK,TS val 1013848 ecr 0,nop,wscale 6], length 0
19:27:56.930759 IP server-link1.www > client-lan1.46491: Flags [S.], seq 960282134, ack 1958529580, win 5792, options [mss 1460,sackOK,TS val 1013874 ecr 1013848,nop,wscale 6], length 0
19:27:57.077306 IP client-lan1.46492 > server-link1.www: Flags [S], seq 3613344362, win 5840, options [mss 1460,sackOK,TS val 1013885 ecr 0,nop,wscale 6], length 0
19:27:57.077570 IP server-link1.www > client-lan1.46492: Flags [S.], seq 2132341216, ack 3613344363, win 5792, options [mss 1460,sackOK,TS val 1013911 ecr 1013885,nop,wscale 6], length 0
19:27:57.460802 IP client-lan1.46493 > server-link1.www: Flags [S], seq 3884893690, win 5840, options [mss 1460,sackOK,TS val 1013981 ecr 0,nop,wscale 6], length 0
19:27:57.460999 IP server-link1.www > client-lan1.46493: Flags [S.], seq 279528679, ack 3884893691, win 5792, options [mss 1460,sackOK,TS val 1014006 ecr 1013981,nop,wscale 6], length 0
19:27:57.482797 IP client-lan1.46494 > server-link1.www: Flags [S], seq 2239754363, win 5840, options [mss 1460,sackOK,TS val 1013986 ecr 0,nop,wscale 6], length 0
19:27:57.482964 IP server-link1.www > client-lan1.46494: Flags [S.], seq 656185521, ack 2239754364, win 5792, options [mss 1460,sackOK,TS val 1014012 ecr 1013986,nop,wscale 6], length 0
19:27:57.556066 IP client-lan1.46495 > server-link1.www: Flags [S], seq 2710321052, win 5840, options [mss 1460,sackOK,TS val 1014004 ecr 0,nop,wscale 6], length 0
19:27:57.556245 IP server-link1.www > client-lan1.46495: Flags [S.], seq 682114763, ack 2710321053, win 5792, options [mss 1460,sackOK,TS val 1014030 ecr 1014004,nop,wscale 6], length 0
19:27:57.673780 IP client-lan1.46496 > server-link1.www: Flags [S], seq 3113209116, win 5840, options [mss 1460,sackOK,TS val 1014034 ecr 0,nop,wscale 6], length 0
19:27:57.673955 IP server-link1.www > client-lan1.46496: Flags [S.], seq 3206640829, ack 3113209117, win 5792, options [mss 1460,sackOK,TS val 1014060 ecr 1014034,nop,wscale 6], length 0
19:27:57.791795 IP client-lan1.46497 > server-link1.www: Flags [S], seq 3271803434, win 5840, options [mss 1460,sackOK,TS val 1014063 ecr 0,nop,wscale 6], length 0
19:27:57.791963 IP server-link1.www > client-lan1.46497: Flags [S.], seq 1796964667, ack 3271803435, win 5792, options [mss 1460,sackOK,TS val 1014089 ecr 1014063,nop,wscale 6], length 0
19:27:57.896480 IP client-lan1.46498 > server-link1.www: Flags [S], seq 2670763392, win 5840, options [mss 1460,sackOK,TS val 1014090 ecr 0,nop,wscale 6], length 0
19:27:57.896694 IP server-link1.www > client-lan1.46498: Flags [S.], seq 1652230703, ack 2670763393, win 5792, options [mss 1460,sackOK,TS val 1014115 ecr 1014090,nop,wscale 6], length 0
19:27:57.944954 IP client-lan1.46499 > server-link1.www: Flags [S], seq 375729675, win 5840, options [mss 1460,sackOK,TS val 1014102 ecr 0,nop,wscale 6], length 0
19:27:57.945166 IP server-link1.www > client-lan1.46499: Flags [S.], seq 1235342910, ack 375729676, win 5792, options [mss 1460,sackOK,TS val 1014127 ecr 1014102,nop,wscale 6], length 0
19:27:57.959601 IP client-lan1.46500 > server-link1.www: Flags [S], seq 3373916236, win 5840, options [mss 1460,sackOK,TS val 1014105 ecr 0,nop,wscale 6], length 0
19:27:57.959790 IP server-link1.www > client-lan1.46500: Flags [S.], seq 3229177879, ack 3373916237, win 5792, options [mss 1460,sackOK,TS val 1014131 ecr 1014105,nop,wscale 6], length 0
19:27:58.150052 IP client-lan1.46501 > server-link1.www: Flags [S], seq 771494623, win 5840, options [mss 1460,sackOK,TS val 1014153 ecr 0,nop,wscale 6], length 0
19:27:58.150332 IP server-link1.www > client-lan1.46501: Flags [S.], seq 2196308822, ack 771494624, win 5792, options [mss 1460,sackOK,TS val 1014178 ecr 1014153,nop,wscale 6], length 0
19:27:58.260377 IP client-lan1.46502 > server-link1.www: Flags [S], seq 4205128940, win 5840, options [mss 1460,sackOK,TS val 1014181 ecr 0,nop,wscale 6], length 0
19:27:58.260554 IP server-link1.www > client-lan1.46502: Flags [S.], seq 2993490755, ack 4205128941, win 5792, options [mss 1460,sackOK,TS val 1014206 ecr 1014181,nop,wscale 6], length 0
19:27:58.384927 IP client-lan1.46503 > server-link1.www: Flags [S], seq 3442307785, win 5840, options [mss 1460,sackOK,TS val 1014212 ecr 0,nop,wscale 6], length 0
19:27:58.385102 IP server-link1.www > client-lan1.46503: Flags [S.], seq 3608804056, ack 3442307786, win 5792, options [mss 1460,sackOK,TS val 1014237 ecr 1014212,nop,wscale 6], length 0
19:27:58.745446 IP client-lan1.46504 > server-link1.www: Flags [S], seq 3859520706, win 5840, options [mss 1460,sackOK,TS val 1014302 ecr 0,nop,wscale 6], length 0
19:27:58.745718 IP server-link1.www > client-lan1.46504: Flags [S.], seq 1886980802, ack 3859520707, win 5792, options [mss 1460,sackOK,TS val 1014328 ecr 1014302,nop,wscale 6], length 0
19:27:58.752213 IP client-lan1.46505 > server-link1.www: Flags [S], seq 4002649788, win 5840, options [mss 1460,sackOK,TS val 1014303 ecr 0,nop,wscale 6], length 0
19:27:58.752457 IP server-link1.www > client-lan1.46505: Flags [S.], seq 2921637750, ack 4002649789, win 5792, options [mss 1460,sackOK,TS val 1014329 ecr 1014303,nop,wscale 6], length 0
19:27:59.290151 IP client-lan1.46506 > server-link1.www: Flags [S], seq 4034900557, win 5840, options [mss 1460,sackOK,TS val 1014438 ecr 0,nop,wscale 6], length 0
19:27:59.290436 IP server-link1.www > client-lan1.46506: Flags [S.], seq 3336916396, ack 4034900558, win 5792, options [mss 1460,sackOK,TS val 1014464 ecr 1014438,nop,wscale 6], length 0
19:28:00.287321 IP client-lan1.46507 > server-link1.www: Flags [S], seq 1085913540, win 5840, options [mss 1460,sackOK,TS val 1014687 ecr 0,nop,wscale 6], length 0
19:28:00.287570 IP server-link1.www > client-lan1.46507: Flags [S.], seq 1916519838, ack 1085913541, win 5792, options [mss 1460,sackOK,TS val 1014713 ecr 1014687,nop,wscale 6], length 0
19:28:00.342137 IP client-lan1.46508 > server-link1.www: Flags [S], seq 2936670246, win 5840, options [mss 1460,sackOK,TS val 1014701 ecr 0,nop,wscale 6], length 0
19:28:00.342381 IP server-link1.www > client-lan1.46508: Flags [S.], seq 2981197633, ack 2936670247, win 5792, options [mss 1460,sackOK,TS val 1014727 ecr 1014701,nop,wscale 6], length 0
19:28:00.598952 IP client-lan1.46509 > server-link1.www: Flags [S], seq 422619976, win 5840, options [mss 1460,sackOK,TS val 1014765 ecr 0,nop,wscale 6], length 0
19:28:00.599166 IP server-link1.www > client-lan1.46509: Flags [S.], seq 2915765004, ack 422619977, win 5792, options [mss 1460,sackOK,TS val 1014791 ecr 1014765,nop,wscale 6], length 0
19:28:00.606331 IP client-lan1.46510 > server-link1.www: Flags [S], seq 1323001298, win 5840, options [mss 1460,sackOK,TS val 1014767 ecr 0,nop,wscale 6], length 0
19:28:00.606552 IP server-link1.www > client-lan1.46510: Flags [S.], seq 1751889374, ack 1323001299, win 5792, options [mss 1460,sackOK,TS val 1014793 ecr 1014767,nop,wscale 6], length 0
19:28:00.636381 IP client-lan1.46511 > server-link1.www: Flags [S], seq 1690364867, win 5840, options [mss 1460,sackOK,TS val 1014775 ecr 0,nop,wscale 6], length 0
19:28:00.636604 IP server-link1.www > client-lan1.46511: Flags [S.], seq 1773667588, ack 1690364868, win 5792, options [mss 1460,sackOK,TS val 1014800 ecr 1014775,nop,wscale 6], length 0
19:28:00.693374 IP client-lan1.46512 > server-link1.www: Flags [S], seq 962811907, win 5840, options [mss 1460,sackOK,TS val 1014789 ecr 0,nop,wscale 6], length 0
19:28:00.693612 IP server-link1.www > client-lan1.46512: Flags [S.], seq 1811177508, ack 962811908, win 5792, options [mss 1460,sackOK,TS val 1014815 ecr 1014789,nop,wscale 6], length 0
19:28:00.933743 IP client-lan1.46513 > server-link1.www: Flags [S], seq 2236032896, win 5840, options [mss 1460,sackOK,TS val 1014849 ecr 0,nop,wscale 6], length 0
19:28:00.933973 IP server-link1.www > client-lan1.46513: Flags [S.], seq 1361947996, ack 2236032897, win 5792, options [mss 1460,sackOK,TS val 1014875 ecr 1014849,nop,wscale 6], length 0
19:28:00.941381 IP client-lan1.46514 > server-link1.www: Flags [S], seq 121332383, win 5840, options [mss 1460,sackOK,TS val 1014851 ecr 0,nop,wscale 6], length 0
19:28:00.941608 IP server-link1.www > client-lan1.46514: Flags [S.], seq 2860665102, ack 121332384, win 5792, options [mss 1460,sackOK,TS val 1014876 ecr 1014851,nop,wscale 6], length 0
19:28:01.244311 IP client-lan1.46515 > server-link1.www: Flags [S], seq 1822194331, win 5840, options [mss 1460,sackOK,TS val 1014927 ecr 0,nop,wscale 6], length 0
19:28:01.244570 IP server-link1.www > client-lan1.46515: Flags [S.], seq 3058267011, ack 1822194332, win 5792, options [mss 1460,sackOK,TS val 1014952 ecr 1014927,nop,wscale 6], length 0
19:28:01.331207 IP client-lan1.46516 > server-link1.www: Flags [S], seq 2607095129, win 5840, options [mss 1460,sackOK,TS val 1014948 ecr 0,nop,wscale 6], length 0
19:28:01.331430 IP server-link1.www > client-lan1.46516: Flags [S.], seq 1531992553, ack 2607095130, win 5792, options [mss 1460,sackOK,TS val 1014974 ecr 1014948,nop,wscale 6], length 0
19:28:01.368744 IP client-lan1.46517 > server-link1.www: Flags [S], seq 1797712625, win 5840, options [mss 1460,sackOK,TS val 1014958 ecr 0,nop,wscale 6], length 0
19:28:01.368967 IP server-link1.www > client-lan1.46517: Flags [S.], seq 3491581070, ack 1797712626, win 5792, options [mss 1460,sackOK,TS val 1014983 ecr 1014958,nop,wscale 6], length 0
19:28:01.478847 IP client-lan1.46518 > server-link1.www: Flags [S], seq 3682969473, win 5840, options [mss 1460,sackOK,TS val 1014985 ecr 0,nop,wscale 6], length 0
19:28:01.479040 IP server-link1.www > client-lan1.46518: Flags [S.], seq 1853387142, ack 3682969474, win 5792, options [mss 1460,sackOK,TS val 1015011 ecr 1014985,nop,wscale 6], length 0
19:28:01.691659 IP client-lan1.46519 > server-link1.www: Flags [S], seq 2765007191, win 5840, options [mss 1460,sackOK,TS val 1015038 ecr 0,nop,wscale 6], length 0
19:28:01.691895 IP server-link1.www > client-lan1.46519: Flags [S.], seq 1369594721, ack 2765007192, win 5792, options [mss 1460,sackOK,TS val 1015064 ecr 1015038,nop,wscale 6], length 0
19:28:01.949796 IP client-lan1.46520 > server-link1.www: Flags [S], seq 902932265, win 5840, options [mss 1460,sackOK,TS val 1015103 ecr 0,nop,wscale 6], length 0
19:28:01.950026 IP server-link1.www > client-lan1.46520: Flags [S.], seq 954812972, ack 902932266, win 5792, options [mss 1460,sackOK,TS val 1015129 ecr 1015103,nop,wscale 6], length 0
19:28:02.182039 IP client-lan1.46521 > server-link1.www: Flags [S], seq 3188771680, win 5840, options [mss 1460,sackOK,TS val 1015161 ecr 0,nop,wscale 6], length 0
19:28:02.182350 IP server-link1.www > client-lan1.46521: Flags [S.], seq 2814398172, ack 3188771681, win 5792, options [mss 1460,sackOK,TS val 1015187 ecr 1015161,nop,wscale 6], length 0
19:28:02.199612 IP client-lan1.46522 > server-link1.www: Flags [S], seq 1357393974, win 5840, options [mss 1460,sackOK,TS val 1015165 ecr 0,nop,wscale 6], length 0
19:28:02.199871 IP server-link1.www > client-lan1.46522: Flags [S.], seq 3648195532, ack 1357393975, win 5792, options [mss 1460,sackOK,TS val 1015191 ecr 1015165,nop,wscale 6], length 0
19:28:02.345982 IP client-lan1.46523 > server-link1.www: Flags [S], seq 251123238, win 5840, options [mss 1460,sackOK,TS val 1015202 ecr 0,nop,wscale 6], length 0
19:28:02.346235 IP server-link1.www > client-lan1.46523: Flags [S.], seq 3015295020, ack 251123239, win 5792, options [mss 1460,sackOK,TS val 1015228 ecr 1015202,nop,wscale 6], length 0
19:28:02.552176 IP client-lan1.46524 > server-link1.www: Flags [S], seq 1126253595, win 5840, options [mss 1460,sackOK,TS val 1015253 ecr 0,nop,wscale 6], length 0
19:28:02.552401 IP server-link1.www > client-lan1.46524: Flags [S.], seq 3505857304, ack 1126253596, win 5792, options [mss 1460,sackOK,TS val 1015279 ecr 1015253,nop,wscale 6], length 0
19:28:02.768407 IP client-lan1.46525 > server-link1.www: Flags [S], seq 2789616684, win 5840, options [mss 1460,sackOK,TS val 1015307 ecr 0,nop,wscale 6], length 0
19:28:02.768601 IP server-link1.www > client-lan1.46525: Flags [S.], seq 493477695, ack 2789616685, win 5792, options [mss 1460,sackOK,TS val 1015333 ecr 1015307,nop,wscale 6], length 0
19:28:03.271585 IP client-lan1.46526 > server-link1.www: Flags [S], seq 3848723179, win 5840, options [mss 1460,sackOK,TS val 1015433 ecr 0,nop,wscale 6], length 0
19:28:03.271835 IP server-link1.www > client-lan1.46526: Flags [S.], seq 3461128787, ack 3848723180, win 5792, options [mss 1460,sackOK,TS val 1015459 ecr 1015433,nop,wscale 6], length 0
19:28:03.352235 IP client-lan1.46527 > server-link1.www: Flags [S], seq 4052292724, win 5840, options [mss 1460,sackOK,TS val 1015454 ecr 0,nop,wscale 6], length 0
19:28:03.352411 IP server-link1.www > client-lan1.46527: Flags [S.], seq 1898839548, ack 4052292725, win 5792, options [mss 1460,sackOK,TS val 1015479 ecr 1015454,nop,wscale 6], length 0
19:28:03.357605 IP client-lan1.46528 > server-link1.www: Flags [S], seq 1711351222, win 5840, options [mss 1460,sackOK,TS val 1015455 ecr 0,nop,wscale 6], length 0
19:28:03.357742 IP server-link1.www > client-lan1.46528: Flags [S.], seq 1821972847, ack 1711351223, win 5792, options [mss 1460,sackOK,TS val 1015480 ecr 1015455,nop,wscale 6], length 0
19:28:03.394218 IP client-lan1.46529 > server-link1.www: Flags [S], seq 520113063, win 5840, options [mss 1460,sackOK,TS val 1015464 ecr 0,nop,wscale 6], length 0
19:28:03.394387 IP server-link1.www > client-lan1.46529: Flags [S.], seq 2309850094, ack 520113064, win 5792, options [mss 1460,sackOK,TS val 1015490 ecr 1015464,nop,wscale 6], length 0
19:28:03.478025 IP client-lan1.46530 > server-link1.www: Flags [S], seq 4171630364, win 5840, options [mss 1460,sackOK,TS val 1015485 ecr 0,nop,wscale 6], length 0
19:28:03.478200 IP server-link1.www > client-lan1.46530: Flags [S.], seq 3905962510, ack 4171630365, win 5792, options [mss 1460,sackOK,TS val 1015511 ecr 1015485,nop,wscale 6], length 0
19:28:03.493426 IP client-lan1.46531 > server-link1.www: Flags [S], seq 3964424990, win 5840, options [mss 1460,sackOK,TS val 1015489 ecr 0,nop,wscale 6], length 0
19:28:03.493575 IP server-link1.www > client-lan1.46531: Flags [S.], seq 1292357820, ack 3964424991, win 5792, options [mss 1460,sackOK,TS val 1015514 ecr 1015489,nop,wscale 6], length 0
19:28:03.876437 IP client-lan1.46532 > server-link1.www: Flags [S], seq 74164579, win 5840, options [mss 1460,sackOK,TS val 1015584 ecr 0,nop,wscale 6], length 0
19:28:03.876605 IP server-link1.www > client-lan1.46532: Flags [S.], seq 2147803935, ack 74164580, win 5792, options [mss 1460,sackOK,TS val 1015610 ecr 1015584,nop,wscale 6], length 0
19:28:04.102918 IP client-lan1.46533 > server-link1.www: Flags [S], seq 3948328164, win 5840, options [mss 1460,sackOK,TS val 1015641 ecr 0,nop,wscale 6], length 0
19:28:04.103238 IP server-link1.www > client-lan1.46533: Flags [S.], seq 3247712032, ack 3948328165, win 5792, options [mss 1460,sackOK,TS val 1015667 ecr 1015641,nop,wscale 6], length 0
19:28:04.255171 IP client-lan1.46534 > server-link1.www: Flags [S], seq 1835129268, win 5840, options [mss 1460,sackOK,TS val 1015679 ecr 0,nop,wscale 6], length 0
19:28:04.255393 IP server-link1.www > client-lan1.46534: Flags [S.], seq 3129275203, ack 1835129269, win 5792, options [mss 1460,sackOK,TS val 1015705 ecr 1015679,nop,wscale 6], length 0
19:28:04.277834 IP client-lan1.46535 > server-link1.www: Flags [S], seq 1603616340, win 5840, options [mss 1460,sackOK,TS val 1015685 ecr 0,nop,wscale 6], length 0
19:28:04.278004 IP server-link1.www > client-lan1.46535: Flags [S.], seq 36536565, ack 1603616341, win 5792, options [mss 1460,sackOK,TS val 1015710 ecr 1015685,nop,wscale 6], length 0
19:28:04.468993 IP client-lan1.46536 > server-link1.www: Flags [S], seq 3680811377, win 5840, options [mss 1460,sackOK,TS val 1015733 ecr 0,nop,wscale 6], length 0
19:28:04.469145 IP server-link1.www > client-lan1.46536: Flags [S.], seq 1787324280, ack 3680811378, win 5792, options [mss 1460,sackOK,TS val 1015758 ecr 1015733,nop,wscale 6], length 0
19:28:04.631830 IP client-lan1.46537 > server-link1.www: Flags [S], seq 994486907, win 5840, options [mss 1460,sackOK,TS val 1015773 ecr 0,nop,wscale 6], length 0
19:28:04.632031 IP server-link1.www > client-lan1.46537: Flags [S.], seq 4029035465, ack 994486908, win 5792, options [mss 1460,sackOK,TS val 1015799 ecr 1015773,nop,wscale 6], length 0
19:28:04.740224 IP client-lan1.46538 > server-link1.www: Flags [S], seq 4263761765, win 5840, options [mss 1460,sackOK,TS val 1015800 ecr 0,nop,wscale 6], length 0
19:28:04.740456 IP server-link1.www > client-lan1.46538: Flags [S.], seq 2654708621, ack 4263761766, win 5792, options [mss 1460,sackOK,TS val 1015826 ecr 1015800,nop,wscale 6], length 0
19:28:04.842570 IP client-lan1.46539 > server-link1.www: Flags [S], seq 154746367, win 5840, options [mss 1460,sackOK,TS val 1015826 ecr 0,nop,wscale 6], length 0
19:28:04.842790 IP server-link1.www > client-lan1.46539: Flags [S.], seq 987549490, ack 154746368, win 5792, options [mss 1460,sackOK,TS val 1015852 ecr 1015826,nop,wscale 6], length 0
19:28:04.961674 IP client-lan1.46540 > server-link1.www: Flags [S], seq 3505329857, win 5840, options [mss 1460,sackOK,TS val 1015856 ecr 0,nop,wscale 6], length 0
19:28:04.961896 IP server-link1.www > client-lan1.46540: Flags [S.], seq 118982590, ack 3505329858, win 5792, options [mss 1460,sackOK,TS val 1015882 ecr 1015856,nop,wscale 6], length 0
19:28:05.034307 IP client-lan1.46541 > server-link1.www: Flags [S], seq 135096464, win 5840, options [mss 1460,sackOK,TS val 1015874 ecr 0,nop,wscale 6], length 0
19:28:05.034578 IP server-link1.www > client-lan1.46541: Flags [S.], seq 2780702862, ack 135096465, win 5792, options [mss 1460,sackOK,TS val 1015900 ecr 1015874,nop,wscale 6], length 0
19:28:05.214286 IP client-lan1.46542 > server-link1.www: Flags [S], seq 346434558, win 5840, options [mss 1460,sackOK,TS val 1015919 ecr 0,nop,wscale 6], length 0
19:28:05.214536 IP server-link1.www > client-lan1.46542: Flags [S.], seq 1944730227, ack 346434559, win 5792, options [mss 1460,sackOK,TS val 1015945 ecr 1015919,nop,wscale 6], length 0
19:28:05.516036 IP client-lan1.46543 > server-link1.www: Flags [S], seq 1416839578, win 5840, options [mss 1460,sackOK,TS val 1015994 ecr 0,nop,wscale 6], length 0
19:28:05.516247 IP server-link1.www > client-lan1.46543: Flags [S.], seq 3296988184, ack 1416839579, win 5792, options [mss 1460,sackOK,TS val 1016020 ecr 1015994,nop,wscale 6], length 0
19:28:05.596189 IP client-lan1.46544 > server-link1.www: Flags [S], seq 2833983678, win 5840, options [mss 1460,sackOK,TS val 1016015 ecr 0,nop,wscale 6], length 0
19:28:05.596417 IP server-link1.www > client-lan1.46544: Flags [S.], seq 2520619770, ack 2833983679, win 5792, options [mss 1460,sackOK,TS val 1016040 ecr 1016015,nop,wscale 6], length 0
19:28:05.604558 IP client-lan1.46545 > server-link1.www: Flags [S], seq 1155320870, win 5840, options [mss 1460,sackOK,TS val 1016017 ecr 0,nop,wscale 6], length 0
19:28:05.604753 IP server-link1.www > client-lan1.46545: Flags [S.], seq 1592102216, ack 1155320871, win 5792, options [mss 1460,sackOK,TS val 1016042 ecr 1016017,nop,wscale 6], length 0
19:28:05.677301 IP client-lan1.46546 > server-link1.www: Flags [S], seq 2135960352, win 5840, options [mss 1460,sackOK,TS val 1016035 ecr 0,nop,wscale 6], length 0
19:28:05.677487 IP server-link1.www > client-lan1.46546: Flags [S.], seq 725077698, ack 2135960353, win 5792, options [mss 1460,sackOK,TS val 1016060 ecr 1016035,nop,wscale 6], length 0
19:28:05.829643 IP client-lan1.46547 > server-link1.www: Flags [S], seq 611702278, win 5840, options [mss 1460,sackOK,TS val 1016073 ecr 0,nop,wscale 6], length 0
19:28:05.829841 IP server-link1.www > client-lan1.46547: Flags [S.], seq 1145539064, ack 611702279, win 5792, options [mss 1460,sackOK,TS val 1016099 ecr 1016073,nop,wscale 6], length 0
19:28:05.909822 IP client-lan1.46548 > server-link1.www: Flags [S], seq 2837771498, win 5840, options [mss 1460,sackOK,TS val 1016093 ecr 0,nop,wscale 6], length 0
19:28:05.910010 IP server-link1.www > client-lan1.46548: Flags [S.], seq 861354502, ack 2837771499, win 5792, options [mss 1460,sackOK,TS val 1016119 ecr 1016093,nop,wscale 6], length 0
19:28:06.681256 IP client-lan1.46549 > server-link1.www: Flags [S], seq 3748135279, win 5840, options [mss 1460,sackOK,TS val 1016286 ecr 0,nop,wscale 6], length 0
19:28:06.681560 IP server-link1.www > client-lan1.46549: Flags [S.], seq 2379147188, ack 3748135280, win 5792, options [mss 1460,sackOK,TS val 1016311 ecr 1016286,nop,wscale 6], length 0
19:28:07.331214 IP client-lan1.46550 > server-link1.www: Flags [S], seq 280025077, win 5840, options [mss 1460,sackOK,TS val 1016448 ecr 0,nop,wscale 6], length 0
19:28:07.331457 IP server-link1.www > client-lan1.46550: Flags [S.], seq 725790318, ack 280025078, win 5792, options [mss 1460,sackOK,TS val 1016474 ecr 1016448,nop,wscale 6], length 0
19:28:07.894214 IP client-lan1.46551 > server-link1.www: Flags [S], seq 3640346934, win 5840, options [mss 1460,sackOK,TS val 1016589 ecr 0,nop,wscale 6], length 0
19:28:07.894495 IP server-link1.www > client-lan1.46551: Flags [S.], seq 3962736424, ack 3640346935, win 5792, options [mss 1460,sackOK,TS val 1016615 ecr 1016589,nop,wscale 6], length 0
19:28:08.264709 IP client-lan1.46552 > server-link1.www: Flags [S], seq 639505764, win 5840, options [mss 1460,sackOK,TS val 1016681 ecr 0,nop,wscale 6], length 0
19:28:08.264994 IP server-link1.www > client-lan1.46552: Flags [S.], seq 2244622049, ack 639505765, win 5792, options [mss 1460,sackOK,TS val 1016707 ecr 1016681,nop,wscale 6], length 0
19:28:08.293652 IP client-lan1.46553 > server-link1.www: Flags [S], seq 1849568110, win 5840, options [mss 1460,sackOK,TS val 1016689 ecr 0,nop,wscale 6], length 0
19:28:08.293847 IP server-link1.www > client-lan1.46553: Flags [S.], seq 976504010, ack 1849568111, win 5792, options [mss 1460,sackOK,TS val 1016714 ecr 1016689,nop,wscale 6], length 0
19:28:08.669291 IP client-lan1.46554 > server-link1.www: Flags [S], seq 351372561, win 5840, options [mss 1460,sackOK,TS val 1016783 ecr 0,nop,wscale 6], length 0
19:28:08.669489 IP server-link1.www > client-lan1.46554: Flags [S.], seq 321424799, ack 351372562, win 5792, options [mss 1460,sackOK,TS val 1016808 ecr 1016783,nop,wscale 6], length 0
19:28:08.990769 IP client-lan1.46555 > server-link1.www: Flags [S], seq 3678574562, win 5840, options [mss 1460,sackOK,TS val 1016863 ecr 0,nop,wscale 6], length 0
19:28:08.991018 IP server-link1.www > client-lan1.46555: Flags [S.], seq 1711492860, ack 3678574563, win 5792, options [mss 1460,sackOK,TS val 1016889 ecr 1016863,nop,wscale 6], length 0
19:28:09.115151 IP client-lan1.46556 > server-link1.www: Flags [S], seq 281066682, win 5840, options [mss 1460,sackOK,TS val 1016894 ecr 0,nop,wscale 6], length 0
19:28:09.115418 IP server-link1.www > client-lan1.46556: Flags [S.], seq 330344364, ack 281066683, win 5792, options [mss 1460,sackOK,TS val 1016920 ecr 1016894,nop,wscale 6], length 0
19:28:09.265197 IP client-lan1.46557 > server-link1.www: Flags [S], seq 4141596457, win 5840, options [mss 1460,sackOK,TS val 1016932 ecr 0,nop,wscale 6], length 0
19:28:09.265423 IP server-link1.www > client-lan1.46557: Flags [S.], seq 4146593141, ack 4141596458, win 5792, options [mss 1460,sackOK,TS val 1016957 ecr 1016932,nop,wscale 6], length 0
19:28:09.623717 IP client-lan1.46558 > server-link1.www: Flags [S], seq 4119136802, win 5840, options [mss 1460,sackOK,TS val 1017021 ecr 0,nop,wscale 6], length 0
19:28:09.623943 IP server-link1.www > client-lan1.46558: Flags [S.], seq 547263442, ack 4119136803, win 5792, options [mss 1460,sackOK,TS val 1017047 ecr 1017021,nop,wscale 6], length 0
19:28:09.816649 IP client-lan1.46559 > server-link1.www: Flags [S], seq 1071335094, win 5840, options [mss 1460,sackOK,TS val 1017069 ecr 0,nop,wscale 6], length 0
19:28:09.816882 IP server-link1.www > client-lan1.46559: Flags [S.], seq 807382874, ack 1071335095, win 5792, options [mss 1460,sackOK,TS val 1017095 ecr 1017069,nop,wscale 6], length 0
19:28:09.903939 IP client-lan1.46560 > server-link1.www: Flags [S], seq 3217503532, win 5840, options [mss 1460,sackOK,TS val 1017091 ecr 0,nop,wscale 6], length 0
